{
  "fixtureVersion": 1,
  "name": "archive-only-none-scope",
  "trustedPublicKey": {
    "kty": "OKP",
    "crv": "Ed25519",
    "kid": "test-2026-07-rfc8032-1",
    "x": "11qYAYKxCrfVS_7TyWQHOg7hcvPapiMlrwIaaPcHURo"
  },
  "jws": {
    "protected": "eyJhbGciOiJFZERTQSIsImtpZCI6InRlc3QtMjAyNi0wNy1yZmM4MDMyLTEiLCJ0eXAiOiJhcHBsaWNhdGlvbi9qYXp6LWRldmljZS1idW5kbGUrandzIn0",
    "payload": "eyJhcmNoaXZlSW5nZXN0VVJMIjoiaHR0cHM6Ly9qYXp6LmV4YW1wbGUudGVzdC9hcGkvYXJjaGl2ZS1pbmdlc3RzIiwiYXJlYUlkIjoiZmluYW5jZSIsImF1ZGllbmNlIjoiamF6ei1kZXNrdG9wLWNsaWVudCIsImJ1bmRsZUV4cGlyZXNBdCI6IjIwMjYtMDctMjRUMDk6NDU6MDBaIiwiYnVuZGxlSWQiOiJqZGJfMDE4ZmYzYTI2NzlhN2JkMThhNWU2YzNkNGIyYTE5MDkiLCJjb21wYW55SWQiOiJhY21lIiwiY29tcG9uZW50QWNjZXNzIjpbXSwiZGV2aWNlSWQiOiJtYWMtZmluYW5jZS0wMSIsImV4cGlyZXNBdCI6IjIwMjYtMDgtMjNUMDk6MzA6MDBaIiwiZ2VuZXJhdGlvbiI6OCwiaXNzdWVkQXQiOiIyMDI2LTA3LTI0VDA5OjMwOjAwWiIsImlzc3VlciI6Imh0dHBzOi8vamF6ei5leGFtcGxlLnRlc3QiLCJraW5kIjoiamF6ei1kZXZpY2UtYnVuZGxlIiwicHJvamVjdElkIjoiODYyNSIsInNjaGVtYVZlcnNpb24iOjIsInNpbmtCdWNrZXRJZCI6bnVsbCwic3RhY2tVUkwiOiJodHRwczovL2Nvbm5lY3Rpb24ua2Vib29sYS5jb20iLCJzdHJlYW1FbmRwb2ludCI6bnVsbCwic3RyZWFtU291cmNlSWQiOm51bGwsInRva2VuIjoiODYyNS0xMjM0NTctVEVTVC1BUkNISVZFLVRPS0VOLU5PVC1BLVNFQ1JFVCIsInRva2VuQnVja2V0U2NvcGUiOiJub25lIiwidG9rZW5JZCI6IjEyMzQ1NyJ9",
    "signature": "e46UynMew3Uhsp8fhuFyYGJm36qlG_jxl6It_0gGGhHDZOZt0VVVNJHPbW16bTpwI71JN0J8hV8-VsYAhuOQDg"
  },
  "expectedPayload": {
    "schemaVersion": 2,
    "kind": "jazz-device-bundle",
    "bundleId": "jdb_018ff3a2679a7bd18a5e6c3d4b2a1909",
    "generation": 8,
    "issuer": "https://jazz.example.test",
    "audience": "jazz-desktop-client",
    "issuedAt": "2026-07-24T09:30:00Z",
    "bundleExpiresAt": "2026-07-24T09:45:00Z",
    "deviceId": "mac-finance-01",
    "companyId": "acme",
    "areaId": "finance",
    "projectId": "8625",
    "stackURL": "https://connection.keboola.com",
    "archiveIngestURL": "https://jazz.example.test/api/archive-ingests",
    "token": "8625-123457-TEST-ARCHIVE-TOKEN-NOT-A-SECRET",
    "tokenId": "123457",
    "expiresAt": "2026-08-23T09:30:00Z",
    "tokenBucketScope": "none",
    "sinkBucketId": null,
    "componentAccess": [],
    "streamSourceId": null,
    "streamEndpoint": null
  }
}
